[
  {
    "listing_id": "lst_a1b2c3d4e5f60001",
    "url": "https://streeteasy.com/building/jackson-park-lic/studio-2b",
    "source": "streeteasy.com",
    "price_monthly": 3050,
    "bedrooms": 0,
    "borough": "Queens",
    "fetched_at": "2026-06-15T10:00:00Z",
    "run_id": "demo_run_lic_001",
    "address": "28-10 Jackson Ave, Long Island City, NY 11101",
    "neighborhood": "Long Island City",
    "bathrooms": 1,
    "sq_ft": 510,
    "available_date": "2026-07-01",
    "listing_date": "2026-06-10",
    "description_snippet": "Modern studio in Jackson Park with floor-to-ceiling windows and stunning Manhattan skyline views. Building features resort-style amenities including rooftop pool, fitness center, and 24-hour doorman.",
    "amenities": ["doorman", "elevator", "gym", "rooftop pool", "package room", "concierge", "bike storage"],
    "pet_policy": "pets_allowed",
    "laundry": "in_unit",
    "doorman": true,
    "elevator": true,
    "no_fee": false,
    "listing_type": "studio",
    "floor": 12,
    "quality_tier": "high",
    "raw_listing_path": null,
    "status": "active",
    "structured_at": "2026-06-15T10:05:00Z"
  },
  {
    "listing_id": "lst_a1b2c3d4e5f60002",
    "url": "https://streeteasy.com/building/tower-28-lic/studio-5f",
    "source": "streeteasy.com",
    "price_monthly": 2875,
    "bedrooms": 0,
    "borough": "Queens",
    "fetched_at": "2026-06-15T10:10:00Z",
    "run_id": "demo_run_lic_001",
    "address": "44-28 Purves St, Long Island City, NY 11101",
    "neighborhood": "Long Island City",
    "bathrooms": 1,
    "sq_ft": 475,
    "available_date": "2026-07-15",
    "listing_date": "2026-06-08",
    "description_snippet": "Well-maintained studio steps from the 7 train. Open kitchen with stainless steel appliances, large closet, and hardwood floors throughout. Building has updated laundry room and responsive super.",
    "amenities": ["elevator", "laundry in building", "storage", "intercom", "bike room"],
    "pet_policy": "cats_only",
    "laundry": "in_building",
    "doorman": false,
    "elevator": true,
    "no_fee": true,
    "listing_type": "studio",
    "floor": 5,
    "quality_tier": "high",
    "raw_listing_path": null,
    "status": "active",
    "structured_at": "2026-06-15T10:15:00Z"
  },
  {
    "listing_id": "lst_a1b2c3d4e5f60003",
    "url": "https://streeteasy.com/building/the-forge-lic/studio-7c",
    "source": "streeteasy.com",
    "price_monthly": 3195,
    "bedrooms": 0,
    "borough": "Queens",
    "fetched_at": "2026-06-15T10:20:00Z",
    "run_id": "demo_run_lic_001",
    "address": "43-10 Crescent St, Long Island City, NY 11101",
    "neighborhood": "Long Island City",
    "bathrooms": 1,
    "sq_ft": 545,
    "available_date": "2026-07-01",
    "listing_date": "2026-06-12",
    "description_snippet": "Brand-new luxury studio at The Forge. Features chef's kitchen, Bosch appliances, and private balcony. Building offers co-working space, dog run, resident lounge, and concierge services.",
    "amenities": ["doorman", "elevator", "gym", "co-working space", "dog run", "resident lounge", "concierge", "balcony", "rooftop deck"],
    "pet_policy": "pets_allowed",
    "laundry": "in_unit",
    "doorman": true,
    "elevator": true,
    "no_fee": false,
    "listing_type": "studio",
    "floor": 7,
    "quality_tier": "high",
    "raw_listing_path": null,
    "status": "active",
    "structured_at": "2026-06-15T10:25:00Z"
  },
  {
    "listing_id": "lst_a1b2c3d4e5f60004",
    "url": "https://renthop.com/listings/23-10-queensboro-plaza-n/studio",
    "source": "renthop.com",
    "price_monthly": 2650,
    "bedrooms": 0,
    "borough": "Queens",
    "fetched_at": "2026-06-15T10:30:00Z",
    "run_id": "demo_run_lic_001",
    "address": "23-10 Queens Plaza N, Long Island City, NY 11101",
    "neighborhood": "Queensboro Plaza",
    "bathrooms": 1,
    "sq_ft": 430,
    "available_date": "2026-07-01",
    "listing_date": "2026-06-05",
    "description_snippet": "Compact but efficient studio near N/W/7 trains. Perfect for commuters. Exposed brick accent wall, updated bathroom. Building has virtual doorman and package locker system.",
    "amenities": ["elevator", "virtual doorman", "package lockers", "laundry in building"],
    "pet_policy": "no_pets",
    "laundry": "in_building",
    "doorman": false,
    "elevator": true,
    "no_fee": true,
    "listing_type": "studio",
    "floor": 3,
    "quality_tier": "medium",
    "raw_listing_path": null,
    "status": "active",
    "structured_at": "2026-06-15T10:35:00Z"
  },
  {
    "listing_id": "lst_a1b2c3d4e5f60005",
    "url": "https://streeteasy.com/building/hunters-point-south-lic/studio-9a",
    "source": "streeteasy.com",
    "price_monthly": 2995,
    "bedrooms": 0,
    "borough": "Queens",
    "fetched_at": "2026-06-15T10:40:00Z",
    "run_id": "demo_run_lic_001",
    "address": "1-50 50th Ave, Long Island City, NY 11101",
    "neighborhood": "Hunters Point",
    "bathrooms": 1,
    "sq_ft": 500,
    "available_date": "2026-08-01",
    "listing_date": "2026-06-13",
    "description_snippet": "Waterfront studio with East River views at Hunters Point South. Affordable luxury with access to the new park, kayak launch, and waterfront esplanade. Building has full amenity suite.",
    "amenities": ["doorman", "elevator", "gym", "waterfront park access", "courtyard", "children's playroom", "bike storage", "parking available"],
    "pet_policy": "pets_allowed",
    "laundry": "in_unit",
    "doorman": true,
    "elevator": true,
    "no_fee": false,
    "listing_type": "studio",
    "floor": 9,
    "quality_tier": "high",
    "raw_listing_path": null,
    "status": "active",
    "structured_at": "2026-06-15T10:45:00Z"
  },
  {
    "listing_id": "lst_a1b2c3d4e5f60006",
    "url": "https://apartments.com/lic-dutch-kills-studio-2f",
    "source": "apartments.com",
    "price_monthly": 2450,
    "bedrooms": 0,
    "borough": "Queens",
    "fetched_at": "2026-06-15T10:50:00Z",
    "run_id": "demo_run_lic_001",
    "address": "35-24 36th St, Long Island City, NY 11106",
    "neighborhood": "Dutch Kills",
    "bathrooms": 1,
    "sq_ft": 395,
    "available_date": "2026-07-01",
    "listing_date": "2026-06-01",
    "description_snippet": "Affordable studio in quiet Dutch Kills block. Walk to R/M/N/W trains. No-fee listing in a small boutique building. Recently renovated kitchen and bathroom. Great value in LIC.",
    "amenities": ["elevator", "laundry in building", "storage"],
    "pet_policy": "case_by_case",
    "laundry": "in_building",
    "doorman": false,
    "elevator": true,
    "no_fee": true,
    "listing_type": "studio",
    "floor": 2,
    "quality_tier": "medium",
    "raw_listing_path": null,
    "status": "active",
    "structured_at": "2026-06-15T10:55:00Z"
  },
  {
    "listing_id": "lst_a1b2c3d4e5f60007",
    "url": "https://streeteasy.com/building/citylights-lic/studio-15b",
    "source": "streeteasy.com",
    "price_monthly": 3150,
    "bedrooms": 0,
    "borough": "Queens",
    "fetched_at": "2026-06-15T11:00:00Z",
    "run_id": "demo_run_lic_001",
    "address": "46-01 Center Blvd, Long Island City, NY 11101",
    "neighborhood": "Long Island City",
    "bathrooms": 1,
    "sq_ft": 520,
    "available_date": "2026-07-01",
    "listing_date": "2026-06-14",
    "description_snippet": "High-floor studio at CityLights with panoramic Midtown Manhattan views. Full-service doorman building on the waterfront. Updated unit with stainless appliances and generous closet space.",
    "amenities": ["doorman", "elevator", "gym", "rooftop deck", "parking available", "laundry in building", "concierge"],
    "pet_policy": "dogs_ok_small",
    "laundry": "in_building",
    "doorman": true,
    "elevator": true,
    "no_fee": false,
    "listing_type": "studio",
    "floor": 15,
    "quality_tier": "high",
    "raw_listing_path": null,
    "status": "active",
    "structured_at": "2026-06-15T11:05:00Z"
  },
  {
    "listing_id": "lst_a1b2c3d4e5f60008",
    "url": "https://renthop.com/listings/lic-greenpoint-ave-studio",
    "source": "renthop.com",
    "price_monthly": 2750,
    "bedrooms": 0,
    "borough": "Queens",
    "fetched_at": "2026-06-15T11:10:00Z",
    "run_id": "demo_run_lic_001",
    "address": "47-16 11th St, Long Island City, NY 11101",
    "neighborhood": "Long Island City",
    "bathrooms": 1,
    "sq_ft": 460,
    "available_date": "2026-07-15",
    "listing_date": "2026-06-09",
    "description_snippet": "Sunny studio on a quiet LIC residential block. Hardwood floors, dishwasher, and plenty of natural light. Easy access to G and 7 trains. Pet-friendly building with responsive management.",
    "amenities": ["elevator", "gym", "laundry in building", "intercom", "storage"],
    "pet_policy": "pets_allowed",
    "laundry": "in_building",
    "doorman": false,
    "elevator": true,
    "no_fee": false,
    "listing_type": "studio",
    "floor": 4,
    "quality_tier": "medium",
    "raw_listing_path": null,
    "status": "active",
    "structured_at": "2026-06-15T11:15:00Z"
  },
  {
    "listing_id": "lst_a1b2c3d4e5f60009",
    "url": "https://streeteasy.com/building/instrata-lic/studio-6d",
    "source": "streeteasy.com",
    "price_monthly": 3050,
    "bedrooms": 0,
    "borough": "Queens",
    "fetched_at": "2026-06-15T11:20:00Z",
    "run_id": "demo_run_lic_001",
    "address": "5-27 47th Rd, Long Island City, NY 11101",
    "neighborhood": "Long Island City",
    "bathrooms": 1,
    "sq_ft": 495,
    "available_date": "2026-07-01",
    "listing_date": "2026-06-11",
    "description_snippet": "Modern studio at Instrata with high-end finishes. Spa-quality bathrooms, chef's kitchen with Bertazzoni range. Building features 24hr concierge, 75ft heated pool, and skyline terraces.",
    "amenities": ["doorman", "elevator", "pool", "gym", "spa", "concierge", "rooftop terrace", "bike storage", "package room"],
    "pet_policy": "pets_allowed",
    "laundry": "in_unit",
    "doorman": true,
    "elevator": true,